<?xml version="1.0" encoding="utf-8" ?>
<Datatable xmlns:xsi="http://www.w3.org/2001/XMLSchema-instance" xmlns:xsd="http://www.w3.org/2001/XMLSchema" xsi:noNamespaceSchemaLocation="../../Schemas/Droplist.xsd">
	<!-- Droplists with Terraformation 1 -->
	<Droplist Name="DroplistTechnologyEra2" Selector="Weighted" RetryOnFailure="true" Fallback="DroplistTechnologyEra3">
		<!-- Stage 2 -->
		<Technology Name="TechnologyDefinitionEconomyAndTrade3"                             Weight="1"/>
		<Technology Name="TechnologyDefinitionEconomyAndTrade4"                             Weight="1"/>
		<Technology Name="TechnologyDefinitionEconomyAndTrade4TimeLords"                    Weight="1"/>
		<Technology Name="TechnologyDefinitionEconomyAndTrade5"                             Weight="1"/>
		<Technology Name="TechnologyDefinitionEconomyAndTrade5Vampirilis"                   Weight="1"/>
		<Technology Name="TechnologyDefinitionEconomyAndTrade25"                            Weight="1"/>
		<Technology Name="TechnologyDefinitionEconomyAndTrade25TimeLords"                   Weight="1"/>
		<Technology Name="TechnologyDefinitionEconomyAndTrade25Unfallen"                    Weight="1"/>
		<Technology Name="TechnologyDefinitionEconomyAndTrade25Horatio"                     Weight="1"/>

		<Technology Name="TechnologyDefinitionUnique1"										Weight="1"/>
		<Technology Name="TechnologyDefinitionEmpireDevelopment3"                           Weight="1"/>
		<Technology Name="TechnologyDefinitionEmpireDevelopment3Horatio"                    Weight="1"/>
		<Technology Name="TechnologyDefinitionEmpireDevelopment3Sophons"                    Weight="1"/>
		<Technology Name="TechnologyDefinitionEmpireDevelopment4"                           Weight="1"/>
		<Technology Name="TechnologyDefinitionEmpireDevelopment4Vampirilis"                 Weight="1"/>
		<Technology Name="TechnologyDefinitionEmpireDevelopment5"                           Weight="1"/>
		<Technology Name="TechnologyDefinitionEmpireDevelopment5Unfallen"                   Weight="1"/>
		<Technology Name="TechnologyDefinitionEmpireDevelopment5TimeLords"                  Weight="1"/>

		<Technology Name="TechnologyDefinitionMilitary3"                                    Weight="2"/>
		<Technology Name="TechnologyDefinitionMilitary3Vampirilis"                          Weight="2"/>
		<Technology Name="TechnologyDefinitionMilitary4"                                    Weight="2"/>
		<Technology Name="TechnologyDefinitionMilitary5"                                    Weight="2"/>
		<Technology Name="TechnologyDefinitionMilitary6"                                    Weight="2"/>
		<Technology Name="TechnologyDefinitionMilitary6Unfallen"                            Weight="2"/>

		<Technology Name="TechnologyDefinitionScienceAndExploration25"                      Weight="6"/>
		<Technology Name="TechnologyDefinitionScienceAndExploration25Unfallen"              Weight="6"/>
		<Technology Name="TechnologyDefinitionScienceAndExploration25TimeLords"             Weight="6"/>
		<Technology Name="TechnologyDefinitionScienceAndExploration4"                       Weight="6"/>
		<Technology Name="TechnologyDefinitionScienceAndExploration4Unfallen"               Weight="6"/>
		<Technology Name="TechnologyDefinitionScienceAndExploration4TimeLords"              Weight="6"/>
		<Technology Name="TechnologyDefinitionScienceAndExploration4WormholeUnique"         Weight="6"/>
		<Technology Name="TechnologyDefinitionScienceAndExploration4Wormhole"               Weight="6"/>
		<Technology Name="TechnologyDefinitionScienceAndExploration4UnfallenWormholeUnique" Weight="6"/>
		<Technology Name="TechnologyDefinitionScienceAndExploration4UnfallenWormhole"       Weight="6"/>
		<Technology Name="TechnologyDefinitionScienceAndExploration4TimeLordsWormholeUnique" Weight="6"/>
		<Technology Name="TechnologyDefinitionScienceAndExploration4TimeLordsWormhole"      Weight="6"/>
		<Technology Name="TechnologyDefinitionScienceAndExploration4Vaulters"               Weight="6"/>
		<Technology Name="TechnologyDefinitionScienceAndExploration4VaultersWormholeUnique" Weight="6"/>
		<Technology Name="TechnologyDefinitionScienceAndExploration4VaultersWormhole"       Weight="6"/>
		<Technology Name="TechnologyDefinitionScienceAndExploration5"                       Weight="6"/>
		<Technology Name="TechnologyDefinitionScienceAndExploration5Unfallen"               Weight="6"/>
		<Technology Name="TechnologyDefinitionScienceAndExploration5TimeLords"              Weight="6"/>
		<Technology Name="TechnologyDefinitionScienceAndExploration5Vampirilis"             Weight="6"/>
		<Technology Name="TechnologyDefinitionScienceAndExploration28"                      Weight="6"/>
		<Technology Name="TechnologyDefinitionScienceAndExploration28Unfallen"              Weight="6"/>
		<Technology Name="TechnologyDefinitionScienceAndExploration28TimeLords"             Weight="6"/>
		<Technology Name="TechnologyDefinitionScienceAndExploration28TimeLords2"            Weight="6"/>
		<Technology Name="TechnologyDefinitionScienceAndExploration28Sophons"               Weight="6"/>
		<Technology Name="TechnologyDefinitionScienceAndExploration28Horatio"               Weight="6"/>
		<Technology Name="TechnologyDefinitionScienceAndExploration28"                      Weight="6"/>
		<Technology Name="TechnologyDefinitionScienceAndExploration28TimeLordsSophons"      Weight="6"/>
		<Technology Name="TechnologyDefinitionScienceAndExploration28UnfallenSophons"       Weight="6"/>
		<Technology Name="TechnologyDefinitionScienceAndExploration28UnfallenHoratio"       Weight="6"/>
		<Technology Name="TechnologyDefinitionScienceAndExploration28TimeLordsHoratio"      Weight="6"/>
		<Technology Name="TechnologyDefinitionScienceAndExploration28UnfallenTimeLords"     Weight="6"/>
		<Technology Name="TechnologyDefinitionScienceAndExploration28TimeLordsTimeLords"    Weight="6"/>

		<!-- Stage 3 -->
		<Technology Name="TechnologyDefinitionEconomyAndTrade6"                             Weight="1"/>
		<Technology Name="TechnologyDefinitionEconomyAndTrade6Venetians"                    Weight="1"/>
		<Technology Name="TechnologyDefinitionEconomyAndTrade6Vampirilis"                   Weight="1"/>
		<Technology Name="TechnologyDefinitionEconomyAndTrade6VampirilisVenetians"          Weight="1"/>
		<Technology Name="TechnologyDefinitionEconomyAndTrade7"                             Weight="1"/>
		<Technology Name="TechnologyDefinitionEconomyAndTrade7Horatio"                      Weight="1"/>
		<Technology Name="TechnologyDefinitionEconomyAndTrade7Vampirilis"                   Weight="1"/>
		<Technology Name="TechnologyDefinitionEconomyAndTrade7VampirilisHoratio"            Weight="1"/>
		<Technology Name="TechnologyDefinitionEconomyAndTrade8"                             Weight="1"/>
		<Technology Name="TechnologyDefinitionEconomyAndTrade8TimeLords"                    Weight="1"/>
		<Technology Name="TechnologyDefinitionEconomyAndTrade8Unfallen"                     Weight="1"/>
		<Technology Name="TechnologyDefinitionEconomyAndTrade9"                             Weight="1"/>
		<Technology Name="TechnologyDefinitionEconomyAndTrade11"                            Weight="1"/>
		<Technology Name="TechnologyDefinitionEconomyAndTrade11Vampirilis"                  Weight="1"/>
		<Technology Name="TechnologyDefinitionEconomyAndTrade23"                            Weight="1"/>
		<Technology Name="TechnologyDefinitionEconomyAndTrade23Vampirilis"                  Weight="1"/>

		<Technology Name="TechnologyDefinitionEmpireDevelopment17"                          Weight="1"/>
		<Technology Name="TechnologyDefinitionEmpireDevelopment17Unfallen"                  Weight="1"/>
		<Technology Name="TechnologyDefinitionEmpireDevelopment17TimeLords"                 Weight="1"/>
		<Technology Name="TechnologyDefinitionEmpireDevelopment17Terrans"                   Weight="1"/>
		<Technology Name="TechnologyDefinitionEmpireDevelopment17TerransUnfallen"           Weight="1"/>
		<Technology Name="TechnologyDefinitionEmpireDevelopment17TerransTimeLords"          Weight="1"/>
		<Technology Name="TechnologyDefinitionEmpireDevelopment6"                           Weight="1"/>
		<Technology Name="TechnologyDefinitionEmpireDevelopment6Terrans"                    Weight="1"/>
		<Technology Name="TechnologyDefinitionEmpireDevelopment6Cravers"                    Weight="1"/>
		<Technology Name="TechnologyDefinitionUnique2"										Weight="1"/>
		<Technology Name="TechnologyDefinitionUnique3"										Weight="1"/>
		<Technology Name="TechnologyDefinitionUnique4"										Weight="1"/>
		<Technology Name="TechnologyDefinitionUnique5"										Weight="1"/>

		<Technology Name="TechnologyDefinitionMilitary7"                                    Weight="2"/>
		<Technology Name="TechnologyDefinitionMilitary7Cravers"                             Weight="2"/>
		<Technology Name="TechnologyDefinitionMilitary8"                                    Weight="0"/>
		<Technology Name="TechnologyDefinitionMilitary9"                                    Weight="0"/>
		<Technology Name="TechnologyDefinitionMilitary10"                                   Weight="2"/>
		<Technology Name="TechnologyDefinitionMilitary11"                                   Weight="2"/>
		<Technology Name="TechnologyDefinitionMilitary13"                                   Weight="2"/>
		<Technology Name="TechnologyDefinitionMilitary13Cravers"                            Weight="2"/>
		<Technology Name="TechnologyDefinitionMilitary13Terrans"                            Weight="2"/>

		<Technology Name="TechnologyDefinitionScienceAndExploration6"                       Weight="6"/>
		<Technology Name="TechnologyDefinitionScienceAndExploration6Unfallen"               Weight="6"/>
		<Technology Name="TechnologyDefinitionScienceAndExploration6TimeLords"              Weight="6"/>
		<Technology Name="TechnologyDefinitionScienceAndExploration7"                       Weight="6"/>